{
  "$schema": "http://json-schema.org/draft-07/schema#",
  "title": "MapViewConfig",
  "type": "object",
  "required": [
    "title",
    "locations"
  ],
  "properties": {
    "title": {
      "type": "string",
      "description": "The title displayed above the map"
    },
    "locations": {
      "type": "array",
      "description": "Array of locations to display on the map",
      "items": {
        "type": "object",
        "required": [
          "lat",
          "lng"
        ],
        "properties": {
          "lat": {
            "type": "number",
            "description": "Latitude coordinate"
          },
          "lng": {
            "type": "number",
            "description": "Longitude coordinate"
          },
          "label": {
            "type": "string",
            "description": "Optional label for the location"
          }
        },
        "additionalProperties": false
      }
    },
    "zoom": {
      "type": "number",
      "description": "Zoom level for the map display",
      "minimum": 1,
      "maximum": 20
    },
    "showCoordinates": {
      "type": "boolean",
      "description": "Whether to display lat/lng coordinates for each location"
    },
    "height": {
      "type": "number",
      "description": "Height of the map container in pixels",
      "minimum": 100
    },
    "appearance": {
      "type": "object",
      "description": "Visual polish: entrance animation, dark mode colors, responsive breakpoints",
      "properties": {
        "animation": {
          "type": "object",
          "properties": {
            "entrance": {
              "type": "string",
              "enum": [
                "none",
                "fade",
                "slide",
                "scale"
              ],
              "default": "none"
            },
            "duration": {
              "type": "number",
              "default": 300
            },
            "delay": {
              "type": "number",
              "default": 0
            }
          }
        },
        "darkMode": {
          "type": "object",
          "properties": {
            "background": {
              "type": "string"
            },
            "surface": {
              "type": "string"
            },
            "text": {
              "type": "string"
            },
            "textSecondary": {
              "type": "string"
            },
            "accent": {
              "type": "string"
            },
            "border": {
              "type": "string"
            }
          }
        },
        "responsive": {
          "type": "object",
          "properties": {
            "padding": {
              "type": "object",
              "properties": {
                "mobile": {
                  "type": "string"
                },
                "tablet": {
                  "type": "string"
                },
                "desktop": {
                  "type": "string"
                }
              }
            },
            "maxWidth": {
              "type": "object",
              "properties": {
                "mobile": {
                  "type": "string"
                },
                "tablet": {
                  "type": "string"
                },
                "desktop": {
                  "type": "string"
                }
              }
            },
            "fontSize": {
              "type": "object",
              "properties": {
                "mobile": {
                  "type": "number"
                },
                "tablet": {
                  "type": "number"
                },
                "desktop": {
                  "type": "number"
                }
              }
            }
          }
        }
      }
    }
  },
  "additionalProperties": false
}
