{
  "title": "Location",
  "locations": [
    {
      "lat": 37.7749,
      "lng": -122.4194,
      "label": "San Francisco"
    }
  ],
  "zoom": 12,
  "showCoordinates": true,
  "height": 300,
  "appearance": {
    "animation": {
      "entrance": "fade",
      "duration": 300,
      "delay": 0
    },
    "responsive": {
      "padding": {
        "mobile": "16px",
        "tablet": "20px",
        "desktop": "24px"
      }
    }
  }
}
